{"$schema":"./drift-manifest.schema.json","changes":[{"after":{"blockType":"Saturation","id":"block:controller/SpeedLoop/Saturation","name":"Saturation","parameters":{"LowerLimit":{"value":"-1","valueType":"expression"},"UpperLimit":{"value":"1","valueType":"expression"}},"parent":"controller/SpeedLoop","path":"controller/SpeedLoop/Saturation","ports":{"inputs":1,"outputs":1},"reference":null},"before":null,"category":"block","changeId":"chg-88b44c143ec3fd406ed1cf0a","elementId":"block:controller/SpeedLoop/Saturation","elementType":"block","evidence":{"details":{"blockType":"Saturation"},"extractor":"illustrative-fixture"},"functionalClassification":"potentially-functional","kind":"added","match":null,"modelPath":"controller/SpeedLoop/Saturation","property":null},{"after":"single","before":"double","category":"interface","changeId":"chg-030848aa83a85dec964b7263","elementId":"interface:inport:VehicleSpeed","elementType":"inport","evidence":{"details":{},"extractor":"illustrative-fixture"},"functionalClassification":"potentially-functional","kind":"modified","match":{"confidence":1.0,"strategy":"stable-id"},"modelPath":"controller/VehicleSpeed","property":"dataType"},{"after":"3.0","before":"2.5","category":"parameter","changeId":"chg-8c882c9477f1195787029296","elementId":"block:controller/SpeedLoop/Gain","elementType":"block","evidence":{"details":{"blockType":"Gain"},"extractor":"illustrative-fixture"},"functionalClassification":"potentially-functional","kind":"modified","match":{"confidence":1.0,"strategy":"stable-id"},"modelPath":"controller/SpeedLoop/Gain","property":"parameters.Gain.value"}],"comparison":{"baseArtifact":"models/controller-base.slx","status":"complete","targetArtifact":"models/controller-target.slx"},"schemaVersion":"0.1.0","summary":{"added":1,"interfaceChanges":1,"modified":2,"moved":0,"removed":0}}
